{
  "event_type": "recommendation",
  "event_version": "1.0",
  "student": {
    "student_id": "u123",
    "session_id": "sess_001"
  },
  "context": {
    "topic_id": "t_derivadas",
    "skill_ids": [
      "k_regla_potencia"
    ],
    "language": "es",
    "mode": "practice"
  },
  "recommendation": {
    "action": "present_item",
    "item_id": "itm_001",
    "target_difficulty": "facil",
    "support_type": "no_hint"
  },
  "state": {
    "theta_hat": -0.12,
    "se_theta": 0.38,
    "mastery": {
      "k_regla_potencia": 0.71
    }
  },
  "explain": {
    "policy_used": "hybrid_irt_bkt_v1",
    "reason": "max_fisher_information + exposure_control",
    "timestamp": "2025-12-13T18:41:00-05:00"
  }
}